{
  "name": "csv-summary",
  "version": "0.2.0",
  "kind": "python-json",
  "goal": "Summarize a numeric CSV column as count, sum and mean",
  "inputs": {
    "type": "object",
    "required": [
      "csv",
      "column"
    ],
    "additionalProperties": false,
    "properties": {
      "csv": {
        "type": "string",
        "maxLength": 8192
      },
      "column": {
        "type": "string",
        "maxLength": 64
      }
    }
  },
  "outputs": {
    "type": "object",
    "required": [
      "count",
      "sum",
      "mean"
    ],
    "additionalProperties": false,
    "properties": {
      "count": {
        "type": "integer"
      },
      "sum": {
        "type": "number"
      },
      "mean": {
        "type": [
          "number",
          "null"
        ]
      }
    }
  },
  "dependencies": [],
  "steps": [
    "Validate local JSON input",
    "Implement the stated goal",
    "Return JSON conforming to the sealed output contract"
  ],
  "risks": [
    "Generated code is untrusted",
    "No network or host capabilities"
  ],
  "acceptance": [
    "Pass independently authored behavioral cases",
    "Preserve prior passing behavior"
  ],
  "test_plan": [
    "generated",
    "independent",
    "invalid-input",
    "regression",
    "security"
  ],
  "options": {}
}
