{
  "name": "integer-stats",
  "version": "0.2.0",
  "kind": "wasm-json",
  "goal": "Compute sum and count of signed integers",
  "inputs": {
    "type": "array",
    "maxItems": 128,
    "items": {
      "type": "integer",
      "minimum": -1000000,
      "maximum": 1000000
    }
  },
  "outputs": {
    "type": "object",
    "required": [
      "sum",
      "count"
    ],
    "additionalProperties": false,
    "properties": {
      "sum": {
        "type": "integer"
      },
      "count": {
        "type": "integer"
      }
    }
  },
  "dependencies": [],
  "steps": [
    "Validate local JSON input",
    "Implement the stated goal",
    "Return JSON conforming to the sealed output contract"
  ],
  "risks": [
    "Generated code is untrusted",
    "No network or host capabilities"
  ],
  "acceptance": [
    "Pass independently authored behavioral cases",
    "Preserve prior passing behavior"
  ],
  "test_plan": [
    "generated",
    "independent",
    "invalid-input",
    "regression",
    "security"
  ],
  "options": {}
}
